{
  "schema_version": 1,
  "run_id": "33333333-3333-4333-8333-333333333333",
  "command": "/spec-review",
  "prompt_version": "findings-emit@1.0",
  "model_versions": {
    "reviewer-default": "claude-opus-4-7"
  },
  "artifact_hash": "sha256:fixture-alpha-fy-spec-v1",
  "created_at": "2026-04-18T09:11:00Z",
  "output_paths": [
    "spec-review/findings.jsonl",
    "spec-review/participation.jsonl",
    "spec-review/survival.jsonl"
  ],
  "status": "ok",
  "warnings": []
}
