{
  "schema_version": 1,
  "run_id": "08ebbed5-c713-482a-887c-02a142fc45d1",
  "command": "/spec-review",
  "prompt_version": "findings-emit@1.0",
  "model_versions": {
    "reviewer-default": "claude-sonnet-4-6"
  },
  "artifact_hash": "sha256:e2f038eecd012a057483da9267d7a78cafc7e030f24154f8d46c420abdc48b3b",
  "created_at": "2026-04-29T07:12:04Z",
  "output_paths": [
    "spec-review/findings.jsonl",
    "spec-review/participation.jsonl",
    "spec-review/run.json"
  ],
  "status": "ok",
  "warnings": [
    "uncommitted-and-not-gitignored"
  ]
}
