{
  "schema_version": 1,
  "run_id": "44444444-4444-4444-8444-444444444444",
  "command": "/plan",
  "prompt_version": "findings-emit@1.0",
  "model_versions": {
    "reviewer-default": "claude-opus-4-7"
  },
  "artifact_hash": "sha256:fixture-alpha-fy-plan-v1",
  "created_at": "2026-04-19T11:42:00Z",
  "output_paths": [
    "plan/findings.jsonl",
    "plan/participation.jsonl"
  ],
  "status": "ok",
  "warnings": []
}
