{
  "schema_version": 1,
  "run_id": "a9a39452-4579-4a30-a57b-267503a33941",
  "command": "/spec-review",
  "prompt_version": "findings-emit@1.0",
  "model_versions": {
    "reviewer-default": "claude-opus-4-7",
    "codex-adversary": "codex"
  },
  "artifact_hash": "sha256:e17de192cb037d9fbe0cb2ba479e2aee2823a4f0ab7548692b0fd2c823be8209",
  "created_at": "2026-05-04T02:19:43Z",
  "output_paths": [
    "spec-review/findings.jsonl",
    "spec-review/participation.jsonl",
    "spec-review/run.json"
  ],
  "status": "ok",
  "warnings": []
}
